{
  "definitions": {
    "categories": "non-GEMM kernels by the segment they sit in",
    "graph_launches_per_step": "graph launches per step (vLLM cudaGraphLaunch; ours HCQ graph executions)",
    "identity": "wall_delta = sum(role deltas) + sum(category deltas) + lifecycle delta",
    "kernel_launches_per_step": "kernels executed per step (graph-replayed nodes included)",
    "kernel_sum_ms_per_step": "sum of kernel durations per step (overlapping kernels count twice)",
    "lifecycle_ms_per_step": "wall - kernel_sum (launch gaps, host sync, scheduling; negative => overlap)",
    "roles": "GEMM ops by role, positional over the layer pattern, helpers (split-K reduce, hi/lo split/sum) included",
    "wall_ms_per_step": "GPU-timeline step period (decode: mean interval between step anchors; prefill: first kernel start .. last kernel end)"
  },
  "layer_pattern": "M-M-M-MM-M-M*-M-M*-M-M-M*-M-M-MM*-MMM-M-M-",
  "model": "NVIDIA-Nemotron-3-Nano-4B-BF16 (RTX 5090)",
  "notes": [
    "ours = tinygrad-self-training exp (DEV=NV, HCQ graph profile, PROFILE=1), vLLM 0.30 (nsys, cuda-graph-trace=node); ours traces 2026-09-26 via bench/spec/ours_prof.py / ours_pf_prof.py (host wall/step printed in each meta).",
    "vLLM B=32 trace was produced 2026-09-26 with VLLM_CACHE_ROOT pointed at a fresh dir (the default cache holds a root-owned flashinfer autotune file that makes the engine fail at warmup).",
    "ours relu2 is fused into ffn_down's input prep (counted in ffn_down); vLLM's relu2 kernel is mlp_act.",
    "norm_residual includes the kernels before the first GEMM of a step (embedding, first norm); sampling_bookkeeping = everything after the output GEMM (sampler, vLLM input prep and mamba align copies).",
    "ours decode steps carry the amortized state flush (state_flush) that runs every ~16 steps."
  ],
  "schema": "boltbeam.lifecycle_comparison.v1",
  "workloads": [
    {
      "batch": 8,
      "comparison": {
        "category_deltas": {
          "attention": {
            "delta_ms": 0.3996,
            "ours_ms": 0.485,
            "vllm_ms": 0.0854
          },
          "mamba": {
            "delta_ms": 0.7026,
            "ours_ms": 1.2257,
            "vllm_ms": 0.5231
          },
          "mlp_act": {
            "delta_ms": -0.0095,
            "ours_ms": 0.0,
            "vllm_ms": 0.0095
          },
          "norm_residual": {
            "delta_ms": 0.1269,
            "ours_ms": 0.199,
            "vllm_ms": 0.0721
          },
          "sampling_bookkeeping": {
            "delta_ms": 0.004,
            "ours_ms": 0.2046,
            "vllm_ms": 0.2006
          },
          "state_flush": {
            "delta_ms": 0.0366,
            "ours_ms": 0.0366,
            "vllm_ms": 0.0
          }
        },
        "gemm_delta_ms": -0.0641,
        "kernel_sum_delta_ms": 1.1961,
        "lifecycle": {
          "delta_ms": 0.318,
          "graph_launch_delta": 4.094,
          "launch_delta": 430.95,
          "ours_ms": 0.4117,
          "vllm_ms": 0.0937
        },
        "non_gemm_delta_ms": 1.2602,
        "ranked_deltas": [
          {
            "delta_ms": 0.7026,
            "term": "category:mamba"
          },
          {
            "delta_ms": 0.3996,
            "term": "category:attention"
          },
          {
            "delta_ms": -0.3608,
            "term": "role:ffn_down"
          },
          {
            "delta_ms": 0.318,
            "term": "lifecycle"
          },
          {
            "delta_ms": 0.1332,
            "term": "role:ssm_in"
          },
          {
            "delta_ms": 0.1269,
            "term": "category:norm_residual"
          },
          {
            "delta_ms": 0.1175,
            "term": "role:attn_qkv"
          },
          {
            "delta_ms": 0.1118,
            "term": "role:ffn_up"
          },
          {
            "delta_ms": -0.0711,
            "term": "role:ssm_out"
          },
          {
            "delta_ms": 0.0368,
            "term": "role:output"
          },
          {
            "delta_ms": 0.0366,
            "term": "category:state_flush"
          },
          {
            "delta_ms": -0.0315,
            "term": "role:attn_o"
          },
          {
            "delta_ms": -0.0095,
            "term": "category:mlp_act"
          },
          {
            "delta_ms": 0.004,
            "term": "category:sampling_bookkeeping"
          }
        ],
        "role_deltas": {
          "attn_o": {
            "delta_ms": -0.0315,
            "ours_ms": 0.1185,
            "vllm_ms": 0.15
          },
          "attn_qkv": {
            "delta_ms": 0.1175,
            "ours_ms": 0.2479,
            "vllm_ms": 0.1304
          },
          "ffn_down": {
            "delta_ms": -0.3608,
            "ours_ms": 1.0182,
            "vllm_ms": 1.379
          },
          "ffn_up": {
            "delta_ms": 0.1118,
            "ours_ms": 1.012,
            "vllm_ms": 0.9002
          },
          "output": {
            "delta_ms": 0.0368,
            "ours_ms": 0.5261,
            "vllm_ms": 0.4893
          },
          "ssm_in": {
            "delta_ms": 0.1332,
            "ours_ms": 1.6493,
            "vllm_ms": 1.5161
          },
          "ssm_out": {
            "delta_ms": -0.0711,
            "ours_ms": 0.8872,
            "vllm_ms": 0.9583
          }
        },
        "share_of_wall_gap": {
          "kernels": 0.79,
          "lifecycle": 0.21
        },
        "status": "ok",
        "wall_delta_ms": 1.514
      },
      "id": "decode_b8",
      "kind": "decode",
      "ours": {
        "attention_layout": "q_k_v",
        "attribution": {
          "forwards_per_step": [
            1
          ],
          "gemm_ops_per_forward_expected": 93,
          "gemm_ops_per_step": [
            93
          ],
          "steps": 64,
          "steps_role_assignment_ok": 64
        },
        "busy_union_ms_per_step": 7.6,
        "categories": {
          "attention": {
            "kernels": 96.0,
            "ms": 0.485
          },
          "mamba": {
            "kernels": 422.0,
            "ms": 1.2257
          },
          "norm_residual": {
            "kernels": 109.0,
            "ms": 0.199
          },
          "sampling_bookkeeping": {
            "kernels": 15.45,
            "ms": 0.2046
          },
          "state_flush": {
            "kernels": 1.5,
            "ms": 0.0366
          }
        },
        "graph_launches_per_step": 5.094,
        "host_wall_ms_per_step": 7.8154,
        "kernel_launches_per_step": 736.95,
        "kernel_sum_ms_per_step": 7.6101,
        "lifecycle_ms_per_step": 0.4117,
        "roles": {
          "attn_k": {
            "kernels": 4.0,
            "ms": 0.0663
          },
          "attn_o": {
            "kernels": 4.0,
            "ms": 0.1185
          },
          "attn_q": {
            "kernels": 4.0,
            "ms": 0.0667
          },
          "attn_v": {
            "kernels": 4.0,
            "ms": 0.1149
          },
          "ffn_down": {
            "kernels": 17.0,
            "ms": 1.0182
          },
          "ffn_up": {
            "kernels": 17.0,
            "ms": 1.012
          },
          "output": {
            "kernels": 1.0,
            "ms": 0.5261
          },
          "ssm_in": {
            "kernels": 21.0,
            "ms": 1.6493
          },
          "ssm_out": {
            "kernels": 21.0,
            "ms": 0.8872
          }
        },
        "side": "ours",
        "source": {
          "jsonl": "$LIFECYCLE_TRACES_DIR/ours_b8_p200.jsonl",
          "meta": "$LIFECYCLE_TRACES_DIR/ours_b8_p200_meta.json"
        },
        "status": "ok",
        "steps": 64,
        "wall_ms_per_step": 8.0218,
        "wall_ms_per_step_median": 7.7428
      },
      "prompt_len": {
        "ours": 200,
        "vllm": 200
      },
      "vllm": {
        "attention_layout": "fused_qkv",
        "attribution": {
          "forwards_per_step": [
            1
          ],
          "gemm_ops_per_forward_expected": 85,
          "gemm_ops_per_step": [
            85
          ],
          "steps": 185,
          "steps_role_assignment_ok": 185
        },
        "busy_union_ms_per_step": 6.414,
        "categories": {
          "attention": {
            "kernels": 20.0,
            "ms": 0.0854
          },
          "mamba": {
            "kernels": 63.0,
            "ms": 0.5231
          },
          "mlp_act": {
            "kernels": 17.0,
            "ms": 0.0095
          },
          "norm_residual": {
            "kernels": 44.0,
            "ms": 0.0721
          },
          "sampling_bookkeeping": {
            "kernels": 77.0,
            "ms": 0.2006
          }
        },
        "category_detail": {
          "attention/attention": {
            "kernels": 12.0,
            "ms": 0.073
          },
          "attention/other(elementwise/copy)": {
            "kernels": 8.0,
            "ms": 0.0123
          },
          "mamba/gated_rmsnorm(+silu gate)": {
            "kernels": 21.0,
            "ms": 0.029
          },
          "mamba/mamba_conv": {
            "kernels": 21.0,
            "ms": 0.0393
          },
          "mamba/ssm_state_update": {
            "kernels": 21.0,
            "ms": 0.4547
          },
          "mlp_act/relu2": {
            "kernels": 17.0,
            "ms": 0.0095
          },
          "norm_residual/norm/fused": {
            "kernels": 43.0,
            "ms": 0.071
          },
          "norm_residual/sampling/reduce": {
            "kernels": 1.0,
            "ms": 0.0012
          },
          "sampling_bookkeeping/mamba_align_bookkeeping": {
            "kernels": 3.0,
            "ms": 0.0081
          },
          "sampling_bookkeeping/other(elementwise/copy)": {
            "kernels": 49.0,
            "ms": 0.0447
          },
          "sampling_bookkeeping/sampling/reduce": {
            "kernels": 25.0,
            "ms": 0.1479
          }